run_id,user_input,route,answer,status,error,details,duration_seconds,json_path
1,Reduziere Last B um 2 MW,POWERFACTORY,"Die Anforderung, Last B um 2 MW zu reduzieren, wurde nicht umgesetzt. Es wurden keine Vorher- (0 Werte) und Nachher-Werte (0 Werte) für die Knoten-Wirkleistung ermittelt, sodass kein Vergleich möglich war.",ok,,,475.219,router_batch_results\20260423_145610\001_router_result.json
2,Erhöhe Last B um 2 MW. Wie verändert sich die Auslastung der Leitung 4-5?,POWERFACTORY,"Die Auslastung der Leitung 4-5 verringert sich um 0,0013 %.",ok,,,52.895,router_batch_results\20260423_145610\002_router_result.json
3,Schließe Schalter 2.,POWERFACTORY,Die Schalteroperation 'close' wurde für 'Switch 2' (StaSwitch) ausgeführt. Zustand vorher: closed. Zustand nachher: closed. Anschließend wurde ein Lastfluss gerechnet.,ok,,,35.303,router_batch_results\20260423_145610\003_router_result.json
4,Welche Nachbarn hat Bus 4? Nutze Powerfactory.,POWERFACTORY,"Direkte Nachbarn von 'Bus 4' (ElmTerm, Typ bus) im PowerFactory-Topologiegraphen: Line 4-5 (ElmLne), Line 4-6 (ElmLne), T1 (ElmTr2)",ok,,,50.319,router_batch_results\20260423_145610\004_router_result.json
5,Welche Trafos gibt es in Powerfactory?,POWERFACTORY,"Die Anfrage wurde nach PowerFactory geroutet, passt aber aktuell zu keinem unterstützten PowerFactory-Ablauf oder ist noch nicht sicher ausführbar.",error,unsupported_powerfactory_request,,22.479,router_batch_results\20260423_145610\005_router_result.json
6,Wie hoch ist die Spannung von Bus 3? Nutze Powerfactory,POWERFACTORY,Lastflussergebnisse für 'Bus 3' (ElmTerm): Leiter-Leiter-Spannung: 14.144999866485882 kV (Lastflussergebnis) Für die angefragten Ergebnisgrößen wurde zuvor ein Lastfluss gerechnet.,ok,,,569.975,router_batch_results\20260423_145610\006_router_result.json
7,Wie hoch ist die Nennspannung von Bus 3? Nutze Powerfactory.,POWERFACTORY,Basisdaten für 'Bus 3' (ElmTerm): uknom: 13.800000190734863 kV (Basisdaten),ok,,,863.773,router_batch_results\20260423_145610\007_router_result.json
